{"capability_rules":[],"default_capability":"require_consent","interactive_approval":"require_consent","policy_id":"default.desktop","provider_handling":{"error":"block","incomplete":"require_consent","missing_required":"block","not_run":"block","unsupported":"block"},"required_provider_ids":["static.analysis"],"revision":1,"schema":"urn:a-quo:omarchy-plugin-local-policy:v1","unknown_capability":"require_consent","update_handling":{"coverage_regression":"require_consent","indeterminate_comparison":"block","permission_expansion":"require_consent"}}